{
  "MMSI": "215811000",
  "IMO": "9839272",
  "SHIP_ID": "5410912",
  "SHIPNAME": "EVER GIVEN",
  "SHIPTYPE": "70",
  "TYPE_NAME": "Container Ship",
  "MOVE_TYPE": 0,
  "PORT_ID": "12",
  "PORT_NAME": "ROTTERDAM",
  "UNLOCODE": "NLRTM",
  "COUNTRY_CODE": "NL",
  "TIMESTAMP_LT": "2026-06-09 17:42:00",
  "TIMESTAMP_UTC": "2026-06-09T15:42:00Z",
  "DRAUGHT": "150",
  "DESTINATION": "ROTTERDAM",
  "ETA_UTC": "2026-06-09T07:00:00Z",
  "VOYAGE_DURATION": "412.5",
  "DWT": "199629",
  "GT": "220940",
  "MARKET": "Containers"
}
